{
  "schema_version": 1,
  "audit_id": "bioif-r2-two-lab-corona-asset-audit-v1.0.0",
  "evaluated_at": "2026-08-13T00:00:00+00:00",
  "evidence_class": "DEVELOPMENT_OBSERVATION",
  "allowed_claim_level": "EXPLORATORY",
  "access_scope": {
    "source_pair_audit_id": "bioif-r2-two-lab-corona-pair-rescreen-v1.0.0",
    "normal_access_only": true,
    "bulk_downloaded": false,
    "page_metadata_verified": true,
    "asset_bytes_written": false,
    "access_observations": [
      "The PNAS/PMC page lists three named supplementary files, but the normal publisher route returned an access gate and no file bytes were retained.",
      "The Proteomics/PMC page lists two named supplementary files; the page is an author-manuscript record and no supplementary file bytes or reuse terms were retained."
    ]
  },
  "assets": [
    {
      "source_id": "PNAS-2008-LUNDQVIST",
      "asset_name": "supp_105_38_14265__index.html",
      "asset_type": "SUPPLEMENT_INDEX_HTML",
      "declared_size": "730B",
      "article_locator": "https://pmc.ncbi.nlm.nih.gov/articles/PMC2567179/",
      "asset_locator": "https://www.pnas.org/cgi/content/full/0805135105/DCSupplemental",
      "page_observation": "PMC associated-data metadata only; file bytes not obtained",
      "byte_verified": false,
      "reuse_terms": "PNAS_2008_NAS_COPYRIGHT_SCOPE_OWNER_TERMS_NOT_FROZEN",
      "redistributable": false,
      "unit_map_verified": false
    },
    {
      "source_id": "PNAS-2008-LUNDQVIST",
      "asset_name": "0805135105_0805135105SI.pdf",
      "asset_type": "SUPPLEMENT_PDF",
      "declared_size": "811.7KB",
      "article_locator": "https://pmc.ncbi.nlm.nih.gov/articles/PMC2567179/",
      "asset_locator": "https://www.pnas.org/cgi/content/full/0805135105/DCSupplemental",
      "page_observation": "PMC associated-data metadata only; file bytes not obtained",
      "byte_verified": false,
      "reuse_terms": "PNAS_2008_NAS_COPYRIGHT_SCOPE_OWNER_TERMS_NOT_FROZEN",
      "redistributable": false,
      "unit_map_verified": false
    },
    {
      "source_id": "PNAS-2008-LUNDQVIST",
      "asset_name": "0805135105_ST1.xls",
      "asset_type": "SUPPLEMENT_TABLE_XLS",
      "declared_size": "101.5KB",
      "article_locator": "https://pmc.ncbi.nlm.nih.gov/articles/PMC2567179/",
      "asset_locator": "https://www.pnas.org/cgi/content/full/0805135105/DCSupplemental",
      "page_observation": "PMC associated-data metadata only; file bytes not obtained",
      "byte_verified": false,
      "reuse_terms": "PNAS_2008_NAS_COPYRIGHT_SCOPE_OWNER_TERMS_NOT_FROZEN",
      "redistributable": false,
      "unit_map_verified": false
    },
    {
      "source_id": "PROTEOMICS-2011-ZHANG",
      "asset_name": "NIHMS344183-supplement-Supp_Figure.doc",
      "asset_type": "SUPPLEMENT_FIGURE_DOC",
      "declared_size": "2.9MB",
      "article_locator": "https://pmc.ncbi.nlm.nih.gov/articles/PMC3252235/",
      "asset_locator": "https://pmc.ncbi.nlm.nih.gov/articles/PMC3252235/",
      "page_observation": "PMC associated-data metadata only; file bytes not obtained",
      "byte_verified": false,
      "reuse_terms": "AUTHOR_MANUSCRIPT_FAIR_USE_TEXT_MINING_ONLY_SUPPLEMENT_REUSE_NOT_STATED",
      "redistributable": false,
      "unit_map_verified": false
    },
    {
      "source_id": "PROTEOMICS-2011-ZHANG",
      "asset_name": "NIHMS344183-supplement-Supp_Tables.xls",
      "asset_type": "SUPPLEMENT_TABLE_XLS",
      "declared_size": "6.4MB",
      "article_locator": "https://pmc.ncbi.nlm.nih.gov/articles/PMC3252235/",
      "asset_locator": "https://pmc.ncbi.nlm.nih.gov/articles/PMC3252235/",
      "page_observation": "PMC associated-data metadata only; file bytes not obtained",
      "byte_verified": false,
      "reuse_terms": "AUTHOR_MANUSCRIPT_FAIR_USE_TEXT_MINING_ONLY_SUPPLEMENT_REUSE_NOT_STATED",
      "redistributable": false,
      "unit_map_verified": false
    }
  ],
  "decision": {
    "status": "BLOCKED_FIRST_PARTY_BYTES_LICENCE_UNIT_MAP_AND_SHARED_ENDPOINT_REQUIRED",
    "byte_verified_asset_count": 0,
    "redistributable_asset_count": 0,
    "target_status": "NOT_FROZEN",
    "model_use": "PROHIBITED",
    "required_next_evidence": [
      "Obtain the five named files through a normal publisher, repository, or scope-owner route and record SHA-256 and byte count.",
      "Obtain explicit reuse terms for every file; keep PNAS copyright and author-manuscript material outside the public CC0 cohort unless permission is recorded.",
      "Map every result unit in both studies to numeric particle size and material using source-file evidence, not article prose or file order.",
      "Freeze a shared endpoint and preprocessing contract with study-held-out evaluation before any T121 amendment or model use."
    ]
  }
}
